,CyberAttacks,Phishing,Malware
626,log4shell update full bypass find log4j 2150 enable rce with payload,hey my name richmond hi my name want meet richmond anyone else receive kinds email always come womens name either jane air rachel keep block keep receive new one weekly,hackers inject malware multiple extensions fishpig vendor magentowordpress integrations count 200000 download
627,fcc add kaspersky list national security threats,impersonate account spamming comment ask text phone number,researchers spot turkishbased crypto miner malware campaign track nitrokod infect systems across 11 countries
628,colonial hackers steal data thursday ahead shutdown attackers steal nearly 100gb data two hours thursday,blackeye still work whats best one use,vulnerable antivirus driver use ransomware reverse engineer oalabs tutorial
629,fbi access computers around country delete microsoft exchange hack,phone scammed,dissect last version conti ransomware use stepbystep approach
630,im bore cybersecurity next,omnivore threaten,bpfdoor evasive linux backdoor technical analysis
631,microsoft discover critical solarwinds zeroday active attack,click look find link,dataset label benign malicious file
632,hackers exploit samsung preinstalled apps spy users,impact poor privacy practice what happen get hack,learn quickly unpack qbot loader malware
633,security flaw could send dick jail forever,phishing link redirect googlecom,vm malware analysis
634,everybody want hacker data suggest unprecedented interest cybercrime pandemic,phishing even work tesla,kernel malware 2021
635,happy provide advice anyone need,advisory phishing email subway deliver malicious file,new android malware disguise system update
636,consider new windows rdp rce intel vulnerabilities,account get hack please help,north korean apt37 use vba self decode technique inject rokrat
637,nist retire sha1 cryptographic algorithm,scam websites see type email password field even press enter,apt32 multistage macos trojan innovate crimeware script technique
638,fbi warn hackers compromise smart devices swat,analytics expectations phishing simulation campaign,team tnt first cryptomining worm steal aws credentials
639,twitter confirm data breach 54m account sell hacker forum,phishing im sure im scar bank account im sure link legit even use url void,new android ransomware spread covid19 trace app decryption tool publish already
640,reminder microsoft offer free vouchers attend free virtual train events,password security alert,new avaddon ransomware upon run background change follow create new directory case empty z folder within c drive ransomware note create follow instructions process name savaexe description sava
641,google emergency patch chrome 0day exploit two threat group north korea,kannis group from vancouver bc,clop ransomware leak execupharms file fail ransom
642,windows internals priceless resource work digital forensics wish someone introduce sooner im psa,phishing email,virustotalyara v400
643,computer scientists discover new vulnerability affect computers globally,android popup gmail notification direct spam email,linux malware truth grow threat
644,interview fortune 100 cybersecurity recruiter get industry,recent ssn scam,break ta505s crypter smt solver use satisfiability modulo theories smt8 solver break latest variant crypter use get2
645,twilio breach let hackers gain access authy 2fa account,almost fully go paypal scam,mistyped url youbico vs yubico get present malware
646,us gov executive order would oblige disclose security breach impact gov users,facebook phishing scam 450k page view,malware analysis wshrat visual basic rat video
647,whats big deal passwords,dae start get constant appleamazon phishing attempt lately,memory forensics baselines malware detection xpost
648,realistic start learn cybersecurity late 20s hop land new career,phishing voter sit donny seyfer nastf,malware analysis forbix worm
649,chatgpt show promise use ai write malware,effort find paypal phishing email real not find something,learn use scale osquery detect evasive fileless malware stealthy persistence unseen attack etc free video train
650,log4jexploiting worm appear mature rapidly multiple threat group work worm concurrently first may release wild within 2448h,get funny phishing attempt today question,emotet analysis part 2
651,cyber sec professional security practice also use home well workplace,kind shit,malware deobfuscation technique
652,saw drive home,guy phishing,feasible hide malicious code pirate software
653,malware free av,oh noes apple,middle east cyberespionage analyze windshifts mac implant part 2
654,data leak days get ridiculous joke,create phishing web page scrapersnbots blog,bianlian rag riches malware dropper dream
655,survey risk cybersecurity talent gap get worse endpoint,edreams gmail spam bomb,apps disguise security tool bombard users ads track users location
656,godaddy disclose recent security breach expose 12 million account,send phishing website copy passport,anyone run automate malware analysis link
657,attempt diagram everything ive learn problemset endpoint threat recognition past 2 years research final draft,whats point report phishing email,malware attack start fake customerservice call
658,microsoft warn critical windows dns server vulnerability thats wormable,virustotal find official steam website phishing,your windows licence expire ransomware remove easily
659,ransomware gang complain crook steal ransom,much info much,new malware go around antiusb antiusbshortcut
660,norton avast merge 8 billion antivirus empire,accidentally open email click blue link hotmail iphone 7terrified,telegram group malware research
661,appear really want us use word hacker really mean criminal,accidentally visit phishing link do,book computer viruses malware
662,cissp train materials self study,send credit card receipt phisher steal card information use now cancel card,petya ransomware decryptor release
663,top 100000 websites collect everything typebefore hit submit,phishing email im sure amount legit,shifu malware analyze behavior capabilities communications
664,log4j exactly it for dummy,instagram hack,20yearold college student develop distribute 100 successful bank trojans two years
665,minutes trump leave office millions pentagons dormant ip address spring life,dunno else post thisive receive fake email try get log paypalamazonappleetc account sorrynot sorry drunken clown graphics,cuckoo sandbox setupconfiguration tutorial
666,apple google ban kazakhstans browser certificate spy residents,someone scammed company use email,stuxnet zero victims
667,researchers show possible use smartphone duplicate actual key pick physical lock use smartphone microphone work shape key,phishing text,analysis nsa bios backdoor deitybounce infosec institute
668,ios 14 flag tiktok 53 apps spy iphone clipboards,accidentally click bogus link text nervous,divx 10 install system service hijack browser searchnew tab prevent change it
669,analysis 1000000000 leak credentials internet common 10 million passwords hash crack,phishing attempt worry,video write malware help malware analysis
670,microsoft announce 100000 hack custom linux os,phishing email personal email address,botnet servers find infect cobalt strike beacon malware
671,comptia cysa cs0002 free study resources fully update 2021,phishing,stop c2 communications humanoperated ransomware network protection
672,backdoored password manager steal data many 29k enterprises,legit scam,technical analysis pegasus android part 3
673,nist release potential update cybersecurity framework,catch month phishing scam june 2020,awesome hacker search engines
674,microsoft confirm server misconfiguration lead 65000 company data leak,stupidly click phishing link didnt enter info,powershell script use run malicious shellcode reverse shell vs bind shell
675,british intelligence recycle old argument e2e encryption think children,this,annotate malware disassembly function use neural machine translation
676,microsoft say new breach discover probe suspect solarwinds hackers,phishing attempt,identify unknown malware use 4 free threat intelligence service oalabs tutorial
677,930000 children data breach bill melinda gate foundations charity getschooled,check phishing checker phishing malicious activity find im suspicious,massive scan russian ip address vulnerable linux machine azure
678,thank amaze response exif hound exif hound open source mac linux build also available,need help risk something click link,malware analysis discord servers
679,windows kerberos authentication break november update,old email contact hack,malware dataset deep learn
680,selfhosting email twentythree years throw towel oligopoly win,whats pdf phishing mail paypal,notpetya sample source
681,us govt offer 10 million reward tip nationstate hackers,receive open phishing email gmail click link do,wikipedia article memz trojan originally make leurak danooct1s viewer make malwareseries later feature vargskelethor member vinesauce
682,distribute denialofservice ddos attack,suspicious https secure website,kryptocibule malware mine xmr eth cryptonomist
683,need gain cybersecurity experience entry level job,question redditmailcom,revil ransomware press release ready auction leak celebrity data involve bribery sexual scandals top political figure etc price buy now 42 millions
684,stop hear one before novembers patch tuesday update cause domain controller freeze restart lsass memory leak,tag never hear,doom eternals denuvo anticheat detect malware
685,russia create security certificate authority alarm experts,paypal phishing via text,malware analysis perl ddos irc bot video
686,go master cybersecurity,potentially click suspicious link doam breach,echobot malware 71 exploit target scada
687,executive order improve nations cybersecurity white house,phishing email email address,excel 40 macros analysis cobalt strike shellcode injection
688,nissan source code leak online git repo misconfiguration,meteoric rise phishing web attack target nasas telecommuting workers,glupteba malware use bitcoin blockchain update c2 domains
689,email correspondence medibank hackers release,make account ominous email email me yet somehow still reach inbox reply curiosity,difference downloader malware dropper malware
690,dark souls 3 exploit could let hackers take control entire computer,receive email call number im worry,inmemoryonly elf execution without tmpfs
691,sega breach expose personal data 250k users show severe vulnerabilities digital infrastructure,receive scam insurance email come gmail aol account,interception dissect bokbots man browser
692,apache log4j bug chinas industry ministry pull support alibaba cloud report flaw government first,someone create second netlix account email,understand linux malware pdf
693,nso group israeli spyware company add us trade blacklist,rich say j peters email domain address cameroon,abuse wsl evasion
694,social security number cost 4 dark web new report find,recommendation project relate phishing detection engione use machine learn,unpack vbs malware
695,customer data sacred real life example lax perspective customer data its fine say hi,text baltimore number,video analysis android sms worm spy malware analysis
696,russian government hackers penetrate ukrainian military energy critical computer systems us government say,16shop phishing countermeasures,wordbased malware attack use macros threatpost
697,hackers china iran target people work 2020 election campaign president donald trump joe biden russian military hackers interfere 2016 democratic campaign also involve,block newsletterscnetonlinecom suggestions,interest malware unpack method understand
698,cisa dont use singlefactor auth internetexposed systems,evolution phishing five tip avoid catch,cuckoo malware analysis run petya windows vm
699,texas supreme court rule facebook hold liable sex traffic,phishing somebody use email ive get like 6 email,trickbot bank trojan dropper analysis
700,eu privacy watchdogs call facial recognition ban public space,login detail phishing message paypal,question allow post malware code here proof concept code payload
701,top five cybersecurity stories week 113020 12420,paypal scam email accidentally click link fml,starters malware analysis
702,favourite cybersecurity podcast,malicious spam,4 ways malware detect analysis environments
703,arent company use linux main operate system,phishing one minute cybersecurity educational videos checkphish,malware link government kazakhstan target journalists political activists lawyers say report
704,ntlm relay attack petitpotam know far,phished,new backdoor allow full access mac systems
705,second hack team target solarwinds time big breach,affect click link havent download do anything site,cerber ransomware july 1st 2016 campaign indicators
706,ghost become norm,phishers world,bust malvertising myths part 2 malware enter online advertise supplychain
707,team red always win team blue company dont spend money want check box security pandemic company allow protect pii hold,get phone call worry now,aand another chinaz version2 new variant cnc leaseweb
708,russian hackers compromise microsoft cloud customers third party put email data risk,give info phone else protect myself,cryptowall 40 instal nsis installer via exploit kit
709,make ctf help cybersecurity students,well think someones get phone number also get 5 call two clearly spoof number yesterday block them,malware create previous admin find hide old server way figure do
710,people ask burnout factor,accidentally give away name email phone number risk,interest infection north korea
711,china likely stockpile vulnerabilities say microsoft,give navy federal phish 7 10,phishing via steam chat
712,mute button conferencing apps may actually mute mic,spam specifically phishing relate often send twice,malware dynamic analysis class opensecuritytraining
713,classic anime film ghost shell predict future hack cyber security artifical intelligence internet things user data well worth watch,get google calendar do account get compromise,protection citadel get crack
714,21m fantastic bug bounty experience oscp cve 1000 job applications 10 months still cant get job,instagram ray ban hack,obad sophisticate android trojan
715,china use android malware spy ethnic minorities worldwide new research say,short survey phishing,obfuscate powershell script
716,find thumb drive park yesterday bitcoin wallet computer aid,google calendar phishing event,develop trojans shellcode
717,marriott hotel chain hit another data breach,email warn unusual activity microsoft gmail account,fbi stumble war cybercrime
718,new browsertracking hack work even flush cache go incognito,anyone see anything like before,defenders beware case postransomware investigations
719,stay inform cybersecurity topics general,icloud link phishing scam,malicious crx file download
720,heres fbis internal guide get data att tmobile verizon,keep get theses email matter do phishing apple id cc etc,netwalker ransomware affiliate sentence 20 years prison
721,try help people get security security unfiltered podcast,phishing scam protect scam,new batch malicious android apps fill adware malware find google play store instal close 10 million time mobile devices
722,cyber command seek disrupt worlds largest botnet hop reduce potential impact election,get email overnight sure make it sure need take action,conti ransomware gang shut down rebranding smaller units
723,us court find russian national guilty hack linkedin dropbox,interest online quiz see immune phishing email,chinese hackers abuse vlc media player launch malware loader
724,vice prime minister ukraine put call people hackddos list russian websites post telegram control post many websites down,theyre even really try hard,dump whispergates wiper eazfuscator obfuscate loader
725,kind cybersecurity podcast listen day,confuse apple scam,binance exchange help track clop ransomware money launderers
726,make documentary solarwinds hack kind of,hilarious phishing alert account sign intoin future,deep dive malware analysis series hermes ransomware pt 3 crypto operations
727,teen student hack high school software access millions student record find sql injections galore,barclays phishing,purple fox malware worm way expose windows systems
728,coworker exist fbi warn deepfakes interview tech job,chance phishing email,best book malware development
729,cisa release apache log4j scanner find vulnerable apps,phishing o365 creds,linuxmidrashim assembly x64 elf virus
730,propaganda disinformation campaign everywhere design con users make mistake its problem one go far beyond malware ransomware social engineer campaign direct impact society people daily life,bojangles killer deal business email compromise,lightbot trickbots new reconnaissance malware highvalue target
731,python cybersecurity beginners build port scanner,wide sophisticate spearphishing campaign target usa retailers,spyware demystification
732,feel try avoid breach,accidentally ruin scam,static detection portable executable file
733,infosec job hire perspective,simulate phishing family friends,lateral movement
734,announce reddits public bug bounty program launch,steam steam guard code phishing scam,trojan agent tesla malware analysis
735,apply cryptology course,phishing phishing quiz,course include dfir free pluralsight april 2020
736,data breach dea law enforcement system grant cyber criminals access 16 databases cpo magazine,legit site,2020 state malware report malwarebytes labs
737,microsoft defender flag google chrome update suspicious,404 shop unavailable,track revil
738,rip dan kaminsky,mother get this presume phishing,dive deep predator thief obfuscation antianalysis techniques
739,robinhood security breach expose data millions users,second mail get 2 weeks different email,malware analysis legion credential stealerbackdoor video
740,worst case scenario stuff cloud service provider blackbaun ransomwared breach multiple clients domino effect 7 unis 2 charities far hit come forward too,phishing mail ive get 3 days ago go straight spam folder,combine static dynamic analysis approach detect malicious browser extensions
741,1000 ios apps find expose hardcoded aws credentials,indeed phishing email,miss link tibetan group target 1click mobile exploit
742,ceo israeli pegasus spyware firm nso step,scam really convince almost fell it,simple antire trick
743,every company ignore cybersecurity,collect data successful phishing email be,virustotal investigators
744,ransomware rewrite go joint attack windows linux users,phishing ecommerce site become top sponsor ad google,latest static malware analysis techniques
745,top cybersecurity stories week 53121 6421,heres phishing email get,extract 19 year old code execution winrar
746,3tiered approach secure home network,nearly spear phished today,isolate vm malware analysis
747,ultimate list sans cheat sheet,strange email account dont set,ursnif emotet dridex bitpaymer gang link similar loader
748,my phone listen conversations paranoia legitimate concern study find eavesdrop may detect current security mechanisms could even conduct via smartphone motion sensors which less protect microphones 2019,first time poster here get interest one morning though id share it,live forensic collection triage use cylr cdqr skadi
749,twitter image abuse hide zip mp3 file,enter information phishing scam back out need concern,keep current malware trend
750,revil ransomware gang member say double efforts attack us target,fell apple phish earlier help,avcrypt ransomware try uninstall av software
751,experts find three new 15yearold bug linux kernel module,microsoft online login phishing scam,tizi detect block socially engineer spyware android
752,good guy,phishing scammer fail,lnk file jump list
753,massachusetts steamship authority hit ransomware attack ferry delay,look uadmin phishing kit,malware analysis bypass initial infection vector antisandbox technique ursnif bank trojan
754,cloudflare deny data leak 3m customer ip address find dark web,g serum scam,malware analysis elmersglue ransomware unlock without pay correct link
755,anyone else get frustrate company dont take security seriously,get send today legit targetcom email,stantinko massive adware campaign operate covertly since 2012
756,student crash school ddos attack,bank help phishing scam succeed,keep petyas demystify malware family
757,official puerto rico govt lose 26m phishing scam,attackers bypass microsoft office365 atp advance threat protection,demo hackers use overthescreen phishing steal mobile bank credentials
758,annoy part cyber security consult convince random people try help hacker,interest phishing technique target google g suite,analysis hackingteam android malware
759,im sorry salary real,alec muffett via twitter headsup look infosec people reddit website phishing domain redditco use colombian tld act pitchperfect apparent mitm actual reddit return 500 could screenshot it,look youtube channel like danooct1 modern malware
760,profit year 28 billion vodafone cant support hash long passwords,phishing scammer send passport,malware exploit database
761,hacker group frame people crimes commit,paypal phishing email concern,phishing attack social engineer continue account large majority successful cyberattacks influence improve human behaviours must sit heart effective organizationwide response
762,pretty convince tbh,get spammed like 15,use reverse engineer techniques see common malware packer work
763,tiktok secretly load chinese spy software lawsuit claim,facebook phishing remove facebook post contain abusive content,locky ransomware encrypt document databases code bitcoin wallets more forcepoint domain generation code
764,let say hire first only infosec employee new company whats gameplan,frig,inside virustotals pant put spotlight firmware malware
765,windows 11 block rdp bruteforce attack default,job site phishing scam,darkode major computer hack forum dismantle feds
766,alarm employees outsource job,whats play here phishing company contact form bad email address,dozens top porn sit hit massive malvertising attack
767,mute mic reportedly doesnt stop big tech record audio,wife fell phishing attack fml help please,reveton ransomware dangerously evolve
768,microsoft mitigate recordbreaking 347 tbps ddos attack azure customers,anyone know real mail phishing attempt,malware research resources
769,cybersecurity talent crunch create 35 million unfilled job globally 2021,apple disable apple id ah ah mine,apps distribute secret bitcoinmining software embed them make legal part eula
770,cybersecurity buzzword hate most,yup seem legit,safe online compare daily online activities
771,nsa weve learn lesson foreign spy use one crypto backdoors cant say exactly,bank america phishing alert,us uk sanction trickbot conti ransomware operation members
772,people scar smart speakers like google home smartphones even though gps photos microphone camera email passwords,10 phishing urls host valid ssl sit,embed malware alternative data stream
773,aws say mitigate 23 tbps ddos attack largest ever,playasia,us justice dept say sept 14th 3 iranian citizens charge us ransomware attack target power company local govts small businesses nonprofits include domestic violence shelter
774,must read book cybersecurity professionals,receive phishing email track info down i i it,conti ransomware domains iocs
775,twitter ban 32k account push chinese russian turkish propaganda,grandfather seem get phishing email claim affiliate amazon try figure out,new threat alert krane malware
776,encrypt decrypt,photokeeper phishing scam worm other email receive look extremely legit,malware analyst day day ops
777,paypal silently truncate passwords 20 character,hackers evade antimalware antiphishing,malware sample beginner
778,us pass quantum compute cybersecurity preparedness act not,good analysis last paypal phishing scam work,us sanction first crypto exchange allege ransomware tie
779,us australia india japan announce cybersecurity initiatives software supply chain,apparently access reddit frequently trigger federal investigation illegal internet activity,analyze microsoft zeroday exploit cve202140444
780,air force let hackers try hijack orbit satellite defcon hack conference next year air force bring satellite fun glory,cant belive fell paypal phishing,new zeroclick iphone exploit use deploy nso spyware
781,ftx say unauthorized transactions drain millions exchange,use brand phishing attack paypal yahoo well fargo apple,technical analysis vultur android bank trojan leverage brunhilda dropper framework use screen record keylogging capture login credentials
782,hackers breach 60 ad servers load malicious ads,person try phish right,build dynamic malware analysis lab
783,scientists use wifi see people wall,antiphishing chrome extension,create slack channel malware researchers
784,entry level software engineer get pay much better vast majority cybersecurity position,sure report phishing heres list report email address,dns hijack attack home routers
785,isc2 propose bylaws change board directors election,gf receive suspicious email paypal stop enter credit card info name ssn,steal facebook access token webview cookies shareit use 3rd party app not fix yet
786,microsoft want help get job cybersecurity,receive paypal phishing email lead interest page,analysis emotet sample december use embed xsl script squiblytoo
787,candidate question ask end interview hopefully help someone else job hunt,inhouse phishing test,mysticinteresting malwares analyze
788,chinese smart tvs snoop owners,irs phishing scam call back abuse scammer,seek ideasadvice new forensics tool
