,CyberAttacks,Phishing,Malware
0,bill gate twitter hack,click link do check first,someone manage infect file archiveorg
1,ive curated massive repo free cybersecurity resources for community,dave johnson give away money,hmmm
2,network attack,honest expect better,researcher stop wannacry ransomware detain us def con
3,wireshark cheat sheet,wie ich einem phisher die zeit stahl,know evil
4,sell damn data,tmobile phishing scam,analysis scr virus go around steam
5,malware pack dna,phishing attack,hi ive write book past 6 months make vm lab malware analysis among subject pdf
6,security certification progression chart 2020,try buy shoe website realize scam afterwards,microsoft hijack necurs botnet infect 9 million pcs worldwide
7,hack tool cheat sheet,click view entire message,university cincinnati malware analysis reverse engineer course 2020
8,thoughts decade cyber security 10 lessons ive learn,youtube video downloader firefox addon inject malicious javascript everywhere,list ransomware group pr page 2021 remix
9,hit right feel,almost,xenomorph smoothly create malicious overlay target app launch user
10,cybersec cheat sheet flavor huge list inside,believable look phishing email ive see date careful guy phishing cybersecurity alwayschallenge,virustotal longer allow security products use without contribute
11,kali linux team stream free penetration test course twitch,phishing fake instagram email address awareness,lockbit like
12,university minnesota ban contribute linux kernel intentionally introduce security vulnerabilities for research purpose,report weird email university reply feel like award,fbi release master decryption key gandcrab ransomware
13,fujifilm refuse pay ransomware demand restore network backups,work smarter harder,please view post rmalware
14,hire managers sub like,user spot phishing awareness train,start remalware analysis
15,leave,theres way get target twice,beware coronavirus map malware infect computers
16,reform convict computer hacker cause 70000000 damage ama,perhaps convince phishing email ive receive,sunburst solarwinds malware tool tactics methods get start reverse engineer
17,reporter likely charge use view source feature web browser,one users get wellcrafted phishing email masquerade irs design get victims fax personal identifiable information attacker,reverse wannacry ghidra part 1 find killswitch unpack malware
18,tiktok unacceptable security risk remove app store say fcc,try,amas want call professional reverse engineer malware programmers whitepaper author conference speakers
19,protonmail say review tiktoks data collection policies lawsuits cybersecurity white paper past security vulnerabilities privacy policy conclude we find tiktok grave privacy threat likely share data chinese government,get today get quite scar read it old password never visit sit,reverse nodejs malware find author
20,cyber security v reality,make sure know link come from,clever antivm trick observe malicious word document
21,reminder list free cyber constrainingresources rcybersecurity wiki,one users get interest phishing email objective seem make panic contact phony support number,complete guide set malware analysis lab virtualbox inetsim burp
22,all free curated list 6 virtual con 34 train 8 live wlabs grow list,recent comment real life hoomans make feel good give card number harmless mp3 site,solarwinds hackers access microsoft source code company say
23,wife send email question 2way baby monitor,get weird email exactly know do,maze ransomware encrypt via vms evade detection
24,germany pass law allow german intelligence agencies use trojan software citizens without reason suspicion people need know this,anybody else get texts bank america,theres finally way remove xhelper unremovable android malware
25,iphone zeroclick wifi exploit one breathtaking hack ever,sometimes bad guy mess up expose web shell phishing site,beginner malware reverse challenge malwaretech
26,human error always win,game tell final fantasy xiv online,release practical malware analysis starter kit collection pretty much every binary mention book
27,british government hold cabinet meet use zoom tweet meet id,beware phishing site wwwthomastechnet impersonate githubcom,lapsus oxford teen accuse multimillionaire cybercriminal 7 arrest make
28,chief technology officer akamai ive spend last 20 years solve internets toughest challenge ama,so chrome give away 1000 amazon voucher answer question,evasion techniques malware evasion encyclopedia contain 50 techniques use various malwares detect virtualized sandboxed environments
29,common port remember credit packetlifenet,get email bypass gmail filter anyone see scam before,fbi probe string recent ransomware attack us hospitals
30,finally receive copy newborn,google macros phishing,reverse maldevexe ghidra
31,secure password,basic invoice phishing attack encode malicious javascript continue slip past email gateways,safe place run malware microsoft unveil windows sandbox run app disposable virtual machine
32,experience us cybersecurity headhunter ive bring whole team answer question today aua,watch email its design format legit apple email seem like lot people get one,stepbystep analysis russian apt turla backdoor call tinyturla
33,use kaspersky antivirus ditch today honestly go mcafee though theyre awful,notice surge phishing email since coronavirus outbreak,376 malware source cod
34,confessions cyber security hire manager,phishing attempt noreplyredditmailcom,att alien labs find new golang malware botenago target millions routers iot devices 30 exploit
35,kylo understand,password,big sur apple exempt many apps rout thru frameworks 3rdparty firewalls use little snitch lulu allow malware bypass firewalls
36,im security engineer interview entry level role ask me,gophish open source phishing toolkit,linuxfe2o3 rust virus
37,edward snowden oust scammer live stream video,common steam phishing scam,prepare malware analyst interview question
38,via balbix,pyphisher must use phishing tool super easy beginners,fcc add kaspersky list national security threats verge
39,protonmail delete we log ip boast website share french climate activists data authorities,funny share,cnetcom put https bypass malware every software download
40,last year security researcher vinoth kumar alert solarwinds update server could access password solarwinds123,mother victim phishing three time since end 2019,worm spread wanacrypt0r
41,faceapp term,send phishing link,learn reverse malware linux
42,or be best free open source encryption program s,email full name address q3 energy consumption,open source malboxes deploy windows desktop os aws ready malware detonation analysis many tool preinstalled include video demo
43,anonymous release 10gb database nestlé,partner double scammed scammer rinse bank account,zombieland ctf reverse engineer beginners
44,elon need use default passcodes,new phishing attempt use squarespace,confirm ill livestreaming youtube october 5th 8pm est
45,perception,ass try phish steam lmao,hackers create fake cthulhu world playtoearn community include websites discord group social account medium developer site distribute raccoon stealer asyncrat redline passwordstealing malware infections unsuspecting victims
46,never saw beauty math explanation diffiehellman,felt mondatory post,android vpn app 10m install collect traffic send facebook
47,laptops give british schoolkids come preloaded malware talk russia boot,fell phishing scam,conti ransomware source code leak ukrainian researcher
48,anonymous collective officially cyber war russian government anonymous ukraine,ill send contact what tape lens,microsoft longer sign windows drivers process hacker
49,john deere make mockery security issue get hack taunt hackers get hack again,dot matter scam gmail user,video malware theory process injection
50,uber pwned,im new detect phishing attempt im pretty sure one correct im wrong,collection old school doswin9x viruses sourcesdisassembles might interest guy
51,hackers rename putins 73million superyacht fckptn change destination hell,new up phishing myupsinvoice,teslacrypt shut release master decryption key
52,nmap nessus cheat sheet,instagram hack scam support,reverse engineer malware analysis cheat sheet
53,interview dream company im freak out,dude whatsapped me part exchange,ap news ukraine hit cyberattacks destructive malware
54,free cybersecurity labs,cant fake phishing website trace mean still need domain put phishing website on cant see like buy domain vps,imgur exploit blackhats
55,twitch data apparently leak include encrypt passwords payout information,im even sure be even open them keep block them number three,dear windows defender please tell drop malicious code
56,programmer year,fake text paypal link fake login page,ever wonder secret life nigerian spammers definitely article you read one cybercriminals decadelong quest buy rat steal credit card backstabbed colleagues loom paranoia
57,pass comptia security,apple up ship fee lead typeform,apt34 hack tool leak
58,hactivists say hack belarus rail system stop russian military buildup,chase sms text phishing,psa advance malware analysis christopher elisan worth time
59,finally get first pentest job thank rcybersecurity,get phished paypal scam,malware analysis center free tool find share malware
60,update free cyber security search engine resources build subreddit,phishing,exclusive us give ransomware hack similar priority terrorism official say
61,the people breach organization dont certs either simply best comment ive see regard discussions must certification get job cyber security,half phishing sit padlock,bing push malware search chrome
62,walmartexclusive router others sell amazon ebay contain hide backdoors control devices,sort fell phishing scam expect,introductory guide malware analysis
63,python cybersecurity build tool,fake amazon bill pdf manage account link take google doc scam work,revil medibank ransomware negotiations
64,senate pass cybersecurity act force orgs report cyberattacks ransom payments,worst attempt ever,source code informationstealing malware cod rust release free hack forums security analysts already report malware actively use attack
65,cybersecurity school might want renew websites ssl certificate least,fake amazon phishing textsms,new udemy course malware analysis
66,malwarebytes say hack group breach solarwinds,never see phishing,malware get infect malware
67,private information worth experian data breach,internet 25 years fell first ever phishing attack,start reverse engineer malware
68,walmartexclusive router others sell amazon ebay contain hide backdoors control devices,new reddit phishing scam,mystery hacker pwns dridex trojan botnet serve antivirus installer
69,twitter former cybersecurity chief allege company reckless negligent warn grave threats national security democracy,click free discord nitro link discordrgiftcom,security firm kaspersky believe find new cia malware
70,,common extortion email new format,firefox update block malicious cryptominers standard security option
71,microsoft restrict russian federation access update windows 11,scary website almost identical actual usps page freaky stay safe,new cybersecurity podcast malicious life expose human financial power operate surface make cybercrime today
72,vim cheat sheet,new phishing technique leverage google docs feature launch various credential harvest malware attack,ever see two android bank trojans beat victims credit card informationvideo
73,f r e w e l l,phishing scam threaten blackmail,wordpress sit hack display fake cloudflare ddos protection page distribute malware install netsupport rat raccoonstealer passwordstealing trojan
74,boss hire new advisor first demand restful apis response http status code,phishing threaten release info xxx site visit,untold story notpetya devastate cyberattack history
75,various resources information learn d hope yall like it,whats point suspect phishing email say hello,think twitch stream something discuss malware
76,top cybersecurity firm fireeye hack sensitive tool steal,attempt phishing first time happen me unsure,novel pdf malware inject javascript encrypt section adobe type 1 font binaries detectable malware scanners interfere decryptiondecompilation font along new tool malicious pdf analysis
77,researchers bypass last night microsofts emergency patch printnightmare vulnerability achieve remote code execution local privilege escalation official fix instal,avoid get hack social engineer,lisa multiplatform linux sandbox automate malware analysis
78,get first cyber security job,always good remember people professionals phishing live convince,build home lab become malware hunter beginners guide xpost fromrnetsec
79,35m fine morgan stanley unencrypted unwiped hard drive auction,seem legit wellsfargosecuritycom,us government today release alert statebacked hackers use custom covalentstealer malware impacket framework steal sensitive data us organization defense industrial base dib sector
80,listen not oc repost,wtf shit,us government formally blame russia solarwinds hack
81,password default,sneaky sneaky enough,medical data expose via public github repositories
82,fbi recommend use ad block extension perform internet search,real,opensource multiav scanner
83,former solarwinds ceo blame intern solarwinds123 password leak,first national bank use textbook phishing technique standard security practice,interview question malwarevuln research internship
84,linux developers patch security hole faster anyone else say google project zero linux programmers better job patch security hole programmers apple google microsoft,control panel amazon phishing attack,malware wait visit porn site start record
85,disclosure unlimited chase ultimate reward point,real phishing attempt,clear lot effort put create fake antivirus
86,experience us cybersecurity headhunter publish salary guide yearly industry ama,fakebot user mention,detail analysis north koreas lazarus apt malware disguise notepad shell extension
87,social engineer test,phishingwebcorewindowsnet,russian behind locky ransomware sentence french prison bitcoin launder
88,ebay port scan laptop bypass firewall browser,know,install super mario run apk android thats malware
89,sub annoy,ok amazon vericate account,locky distribute hta file 055 virustotal
90,eccouncil credibility,sure right subreddit im wonder scare tactic legitimate its say webcam email dont even computer everything phone,chinese hackers use new windows malware backdoor govt defense orgs
91,north korea hack him take internet,phishers phish,ransomware author release decryption key say goodbye forever malwarebytes
92,us cyber security agencies get 9bn biden plan,check email urls genuine,ryuk ransomware deliberately exclude common linux file paths
93,fundamental skills infosec hire manager review 100 resume do 30 interview people reddit within last month,texted link say boa incorrect login attempt dont even boa account,fake deepnude download give malware instead nudes
94,many people ask cybersecurity learn plan,apple phishing email fortnite vbucks,police body cameras ship preinstalled conficker virus
95,crazy article describe new insane vulnerability get 11 upvotes reddit get global recognition,sure want avoid be guess ill risk permanent disable,wikileaks release surveillance malware use intelligence agencies around world
96,think would appropriate,lol new one me from paypal,ransomware android
97,taiwan prepare possible cyber war china train 3 million citizens osint detect chinese disinformation campaign,grandad receive check 3k mail deposit account wake middle night,exemployees kaspersky lab fake malware harm rival
98,national bank zambia hit ransomware successfully defend critical systems and troll hackers dick pics,get last name,lockbit ransomware group pay first ever 50k bug bounty
99,nvidia allegedly hack hackers steal data back,weebly time collection school email cash,encyclopedia malware sandbox evasion techniques
100,metasploit cheat sheet,bank america phishing scam,malware analysis cve201711882 microsoft office equation editor buffer overflow
101,neverpwned,didnt even spell first name right,first android cryptoransomware misuse accessibility service encrypt data change pin
102,fbi sell phone organize crime read 27 million encrypt message,may dumb question click suspicious link send discord pop up screenshot sender delete message leave server know right subreddit this safe,discover another mobile bank trojan google play 5000 install
103,endtoend encryption explain,obvious sms phishing scam able get first 6 digits bank number bank with vv worry might data leak somewhere change passwords immediately possible thank,skiddos use google network spread upx custom elf ddoser
104,wireshark 10 minutes,would consider form phishing call it,reverse engineer syscalls redteamers use evade detection oalabs stream
105,cyber security role specific job field encompass range different job,ive get tons message number dont know clear motive receive 20 message unique phone number over course couple months try mess time look at purpose this,resource malware analysis learn reverse malware collection guide tool
106,it,seriously open,ccleaner command control cause concern
107,china block encrypt https traffic use tls 13 esni,email scam american home shield,ten years later still get malware via windows media player drm
108,romanian hospital get hit ransomware refuse pay use paper continue activities,hesitant click link expect package that know of im think spam,55 gb vintage malaware
109,use cart 99 smartphones artist simon weckert able generate virtual traffic jam google map this possible turn otherwise empty green street red one impact physical world navigate cars another route,click link text enter postcode worry,ransomware gang switch new intermittent encryption tactic
110,cyberinsurance giant axa hit ransomware attack say would stop cover ransom payments,pnc bank phishing campaingn,cybersecurity researchers discover multiple ongoing malware distribution campaign target internet users seek download copy pirate software
111,make page github mean people jump cybersecurity job field would love feedback add document,lokot cybersec 2fa expert pocket,linux version ransomexx ransomware discover increase range ransomware begin target linux servers
112,microsoft leak 24tb data belong sensitive customer critics furious,get phishing email html attachment do,brutal cryptocurrency mine malware crash pc discover
113,cant careful 5g,anyone know get email amazon maybe track put quit to forward attach block,source code remote access trojan rat dub coderat leak github malware analysts confront developer attack use tool
114,im open source pwned code base,really strong phishing attempt take action,emotet file hash compromise ip address domains malicious powershell artifacts
115,vmware acquire broadcom run look back,lmao,become and remain malware researcher
116,norton 360 cryptominer,keep get worse legit fall email,fake avast internet security impersonate legitimate security software google play
117,try get cybersec like myself better research everything log4shell,click fake reddit link possible get malware it,best tool malware analysisreverse engineer
118,first cybersecurity job,steam account hack phishing,avatar project final edition
119,anonymous leak database russian ministry defence,pension fund pose employer sponsor fund phish users sign service,practical malware analysis alternative
120,get entrylevel security analyst position,stop sms phishing attempt,malware development part 1 series
121,solarwinds hack biden plan executive order strengthen cybersecurity npr,client email hack,us say north korea behind malware attack
122,ace oscp exam grind advice and 2023 study guide,first phishing github repo project fish,new fileless ransomware code injection ability detect wild
123,kylie mcdevitt twitter unpopular opinion cyber security degrees exist specialisation within computer science,try send phishing email get info back pop every time anything it,infinity new tab chrome extension appear compromise apparently run malware script
124,rip john mcafee,potential blockfi scam,pressure mount fbi reveal tor browser exploit
125,break news florida teen get arrest twitter huge hack,yearend phishing report 2020 wmc global,antivirus nostalgia detect 800 viruses get free update 34 months time
126,mmmm data,block spam texts iphone,conti group chat leak
127,earn bill governments plan scan every message online,open cash app scam email click link iphone give email address,fbi cuba ransomware breach 49 us critical infrastructure orgs
128,nsa surveillance expose snowden rule unlawful,im dumb fell online scam need advice,deobfuscating powershell malware droppers
129,8 years hacker operate massive iot botnet download anime videos,need advice,acer hit 50 million revil ransomware attack
130,type malware,amazon phishing,29 address analyze malware faster
131,free udemy course cyber security beginner expert,phishing pretend ransomware,golang wrapper old obscene malware golang use implant wrappers frustrate detection methods
132,infection monkey free opensource network penetration test tool breach attack simulator use realworld attack techniques know vulnerabilities evaluate security easy infection monkey take 3 simple step,xerox scan xxxxxxxxxxxx document important company guideline note,stuxnet
133,put homelab resume,fake netflix message,perilous life computer virus cracker make powerful enemies online
134,sam database vulnerability know far,fake apple email email send link work hyperlinks ask ssn,virtual machine die
135,xkcd comic sql injection,scammer higher education,better history chrome extension still host malware direct bonvoyagetoday
136,gta 6 leak confirm real one biggest leak game history,facebook messenger forward link,fireeye labs obfuscate string solver automatically extract obfuscate string malware
137,this children pay attention cybersecurity,guy try get ship laptop could receive money after,want malware analyst
138,career roadmap,2020 13 phishing attack relate covid19,large collection android malware sample 68 gb
139,weve make 500 hours content free address cybersecurity skills shortage,active facebook phishing campaign,power hybrid analysis everyone go try
140,official certify,thats fair need credit card info password,yes
141,hacker group revil claim attack televangelist kenneth copeland,update account info netflix,step step analysis new version darkside ransomware
142,company rout billions text message quietly say hack several years,email ive get apple support first dont even iphone second look sketchy email address be click sender read apple support really scummy get another email now also even credit card it,highly evasive attacker leverage solarwinds supply chain compromise multiple global victims sunburst backdoor
143,us city reject 53m ransom demand restore encrypt file backup,apple netflix among top 5 imitate brand phishing attack,malwaremustdies new repository openshared cod tool
144,my phone listen conversations paranoia legitimate concern study find eavesdrop activity may detect current security mechanisms could even conduct via motion sensors accessible thirdparty apps without user permission ios android,covid419,reverse wannacry part 2 dive deeper malware ghidra
145,wannacry documentary make,mother click link phishing email pretend attyahoo send message the bottom image contact account change passwords,distribute malware google image service workers vegan twitter bots
146,even legal,ive never use amazon before,ransomware fighter run cost hacker gang millions
147,dangerous google ad disguise wwwgimporg,receive phishing call amazon understand gain,gandcrab ransomware shut claim earn 25 billion
148,please stop force users reset complex passwords,would good idea freemail providers put accountcreationdate email headers,triton worlds murderous malware its spread
149,security researcher identify 300 vulnerabilities software ama,phishing move away internet letter 18882745552,demonstration android malware spread google play remove it
150,im kid ask internship interview advice get contract,target phishing attack financial industry fire3 phishing kit,find malware run new macbook eset avg recognise it think id upload github
151,tech skills extremely important cybersecurity also important calm pressure,amazon email look legit,weve make slack room security think guy would interest
152,twitter fin 150m misuse email phone number collect account security purpose ex 2fa sell target advertisements,recieved follow email cs18entertainmentsadronsutracom phishing,malcat binary editor disassembler decompiler scanner malware analysis linux windows
153,cybersecurity cheat sheet alert glossary cover technical jargon industry insiders love and hate use credit ncsc,16shop commercial phishing kit hide backdoor,abcbot evolve botnet
154,free udemy course cyber security beginner expert,well fargo phishing via text message,microsoft sign malicious netfilter rootkit
155,lastpass say hackers internal access four days,duke university spear phishing,introduction malware analysis malware explain
156,http response status codea must cheatsheet webap network pentesters,get bluehost report phishing website,attention rmalware mods
157,iranian hackers use log4shell mine crypto federal computer system,analyse massive office 365 phishing campaign,emotet return hit 100k mailboxes per day
158,casinos database hack smart fish tank thermometer,find spam folder send email now old password anyone tell ive really hack how,gonnacry ransomware
