,CyberAttacks,Phishing,Malware
310,gitlab run phishing test employees 20 hand credentials,instagram phishing scam safe more info reply,fedex send free parcel sign karate lessons
311,cyberattack force shutdown top us pipeline operator colonial pipeline say shut 5500 miles pipeline take refine gasoline jet fuel along east coast,lol,android tv box amazon come preinstalled malware
312,canshould add list resources right sidebar may sub do get start guide also link common resources,paypal phishing,godfather android malware target 400 bank crypto exchange
313,new ps5 exploit unlock root privilege readwrite memory access,iidentify zero day phishing urls,dozen malicious pypi package discover instal malware modify discord client become informationsealing backdoor steal data web browsers roblox
314,apple award hacker 100000 discover sign apple vulnerability,phished something malicious,impact openssl infinite loop vulnerability cve20220778
315,rockstar game may hack exfiltrate gta 5 6 source code,almost get me use apple thankfully,us disrupt russian cyclops blink botnet use attack
316,slack private github code repositories steal holiday,would happen do this cant see scam get anything,norton promote utilities addon scarewarelike popups
317,hackers link chinese government steal millions covid benefit secret service say,junk mail receive think reddit would like get back,step step build blackmatter esxi payload config extractor
318,sc900 microsoft security compliance identity fundamentals full course need,ive instagram account phished im trouble get back,europol announce takedown emotet botnet netsecnews
319,reality fulltime bug bounty hunt,package redditmailcom,cerberus bank trojan source code release free cyberattackers
320,nist announce first group encryption tool choose postquantum cryptographic standard,fun time troll gift card scammer,new version qbot trojan hijack email thread
321,darkside ransomware gang quit servers bitcoin stash seize,verification code email account,analyse fileless malware cobalt strike beacon
322,malware preinstalled machine order aliexpress china malware could infect usb device plug small pick place machine 4k gbp,user piper_knox tag people phishing them story comment,sophos blog ragnar locker ransomware deploy virtual machine dodge security
323,facebooks new feature allow capture data apps use phone apart facebook super creepy,hey click link random number scar also click load could reach,new emotet c2 servers
324,aipowered bing chat spill secrets via prompt injection attack,think may become victim phishing,malware video analysis check userland rootkit
325,might hack microsoft account,havent see before email content spoof well from line tip,baltimore city ransomware attack expect cost 18 million
326,yup,help,humble book bundle hack 20
327,for first time history anyone join war volunteer join russiaukraine cyber fight,get dmd someone do dig might catch illegal fishermen,hiddenwasp malware sting target linux systems
328,unprivileged user gain root privilege vulnerable host use default sudo configuration cve20213156 heapbased buffer overflow sudo,legit anyone see before,malware childrens book
329,hack plane leak data millions take account,warn steal iphone phishing scam dig observations,ida educational vs ghidra learn malware analysis
330,want millions cybersecurity pros rate whatever want,suspicious spam email accountingandsharesameonmicrosoftcom worry,fake bank apps google play leak steal credit card data mobile bank credentials victims
331,would dothe resources would use get first job cybersecurity higher education experience it little money spend a guide wlinks,think someone hack friends fb account try phish messenger,fight botnets malware love piece malware actually autonomous agent make spread lateral movement happen gray area
332,soc analyst interview question answer,click link google tell passwords successfully store,sit download malware
333,dramatic fall number network attack originate china,spam email,widespread botnet use infect android devices launch massive attack multiple cloud providers month
334,whatever work,clicknot much info google,successful malware farm anyone successfully this
335,german government advise use kaspersky antivirus,ahs american home shield phishing,imgur popup redirect fake virus alert
336,tiktok ban us navy mobile phone cause cybersecurity threat,spamphishing email give tollfree number call get caughtshut down,fbi malware send unencrypted evidence thats good thing
337,hack explain mr robot season 1 episode 1,phishing scam know try set account well fargo,gatekeepers achilles heel unearth macos vulnerability
338,doj say longer prosecute goodfaith hackers cfaa,phishing attempt try facetime well girl theyre impersonate doesnt number,50 domains worth block evolution vipersoftxs underreported dga
339,10 must know cybersecurity tip,get bitcoin phishing email creep gmail report send spam thats mark now,plan try keyboard remapper guy reddit link github project run virustotal look pretty interest im sure mean say file communicate ip usa communicate malicious file
340,fellow cyber security pros get regular feed information,sextortion email,unpack emotet reverse obfuscate word document
341,free burp suite train udemy 1 day leave get course free,phishing mail manage swiggle gmail spam filter,forensic methodology report catch nso group pegasus
342,degree experience stop expect get pay like midsr people,spam yeah right someone access fb accounteh roflmao pathethic phishing attemptfb mail email create nameitwellcom,ukrainian police nab six tie clop ransomware
343,tiktok permanently block texas university network,phishing infographic,easy malware reverse engineer
344,hackers leak thousands coronavirus research paper hide behind paywalls,make deposit bank use app immediately get phishing email deposit obviously phish know bank activities bank app,black kingdom ransomware begin appear exchange servers
345,airgapped systems leak data via sata cable wifi antennas,someone send reddit chat report them,unpack ramnit malware dropper
346,many career question sub,strange text message go family friends,ransomware infection chain excel 40 macro hta vbscript powershell analysis
347,exploit mom,get group spam texts 19 people them seemingly direct gmail account att allow report email spam ideas,assembly language reverse malware analysis resources
348,millions lenovo laptops contain firmwarelevel vulnerabilities,phishing email link phone number call,buy malware amazon
349,hack russia offlimits ukraine war make freeforall,get text it bad click link,146 new vulnerabilities come preinstalled android phone
350,critical valve bug let gamers add unlimited fund steam wallets,get email use full name please tell im ok,munin online hash checker virustotal hybridanalysis anyrun urlhaus
351,congrats rcybersecurity hit 300k members,get email day old highschool account freak minute saw bitcoin request get suspicious,art become trustedinstaller task scheduler edition
352,its happen again att sue allegedly transfer victims number thieve 19m cryptocoin heist,hi guy 160k followers tik tok business email bio brand contact me today get email open attachment phishing right horrible anxiety freak right now,drsemu malware detection classification tool base dynamic behavior
353,confessions marcus hutchins hacker save internet,email spoof attackers impersonate legitimate senders,megacortex ransomware want one
354,reddit user discover card skimmer,pishing real website,feel disappoint continue malware analysis
355,okta say github account hack source code steal,seem illegitamate me,whats everybodys favorite malware netsec news sit
356,russia exclude 30country meet fight ransomware cyber crime,whats scam email contain 800 number no phishing line,hide malware inside image googleusercontent
357,company solarwinds say may hit highly sophisticate hack,click phish link enter information safe clear one redirect link,invisimole spyware hunt secrets stay deep shadow since 2013
358,solarwinds body count include nasa faa,compromise video phish,ghostminer cryptomining malware go fileless
359,haha,securit interactive bot phishing cyberattacks would really really appreciate could try bot,build malware code compiler hack course 2017 part 6
360,no chatgpt write malware anymore,recived email security breach legit this,apk downloader cnetcom contain malware
361,third log4j high severity cve publish mess,learn phishing trend last year avanans prediction expect future,finfisher rootkit analysis
362,hey all start youtube channel short ago instructional videos learn penetration testingethical hack hopefully find informative,phuck phishing,clamav fortinet fix false positive software 2 months 20 fp submissions
363,release early alpha build exif hound pay want gps focus image forensics tool,amazon phishing,sideloaded pokemon go android app find contain malware
364,hire standards nutshell,job scam get email morning domain come sendgridnet job offer little chit chat send another email instructions follow fill blank send back research think scammed even take selfie send person,report malware level drop huge botnet go offline
365,least 30000 us organizations newly hack via hole microsofts email software,self analyze clearly phishing email fellow creator email,collection public malware antianalysis techniques use wild
366,hacker expose scam call center cctv footage educate people,malicious actors target crypto wallets coinbase users new phishing campaign,unpatchable malware infect usbs loose wire
367,get start information security ever grow list resources share copy make own,phishing brand,hacker use new rat malware unseen tactics techniques procedures ttps include novel rat remote access trojan new local privilege escalation tool cuba ransomware attack
368,leak document avast antivirus sell web browse data,email register edultrycom scam,analyze mario theme malware
369,huh,new steam phishing attack go autheleagueopencom,learn easily patch malware use conditional breakpoints quickly uncover iocs
370,exclusive supreme court justices use personal email work burn bag leave open hallways source say,analyze relationship social media cyber threats cyware hacker news,opensecuritytraining2 public betas refresh class x8664 assembly x8664 os internals coreboot open followup malware analysis come soon get start prereqs today
371,white house task nist produce another cybersecurity framework,dot department transportation try text you almost certainly phishing scam dot every send official letter mailbox hope help,pe malware machine learn dataset
372,new course cybersecurity,receive strange email,colonial pipeline ransomware hackers secret weapon selfpromoting cybersecurity firm
373,recruiters ghost,phishing email real domain,malware analysis yara tryhackme cyber defense pathway
374,data 700m linkedin users post sale cyberunderground,pandemic,malware analysis word document tryhackme mal remnux redux
375,one largest us company spirit wine business brand like jack daniels woodford suffer cyber attack intruders allegedly copy 1tb data plan sell important info highest bidder leak rest,altight get couple to bryan not email email always different sender website get filter spam either ideas anyone else run this,gamarueexe malware analysis report
376,firefox 72 automatically block website notifications 2020,stop get send phishing link,global operation disrupt trickbot eset microsoft ntt others
377,dropbox disclose breach hacker steal 130 github repositories,help mom click link email image appear saw place phishing scam do,python malware rise
378,unknown bug automatically delete file microsoft team sharepoint onedrive,lol,platinum hack group strike complex titanium backdoor windows
379,new cybersecurity first job feel really stupid,500000 record healthcare data breach highlight risk phishing attack,leak source code android ransomware sauron locker
380,fbi find huawei equipment midwest could disrupt us nuclear communications cnn,text thread real bank,study belonard trojan exploit zeroday vulnerabilities counterstrike 16
381,cisa release tool aid detect malicious actors m365,didnt fall it bite curious would happen view document enter password get 3 password pdf mail,quick analysis trickbot sample nsas ghidra sre framework
382,fire admin cripple former employers network use old credentials,phishing campaign use captcha fool users email security solutions webtitan,conficker downad 9 years still around why ideas
383,fail interview didnt solve game keep talk one explode,careful whether address bar website contain l i,advices upgrade malware analysis skills
384,question share data,phishing wo link attachment request specific info,technical analysis petya ransomworm
385,log4j vulnerability present black hat 2016,phishing email ask cell number,malwaresearch command line tool find malware openmalwareorg
386,hackers spamming businesses receipt printers antiwork manifestos,amazon phishing email,hacker tailor soldier spy future cyberwar weve see data theft energy grid hack stuxnet open cyberwar yet
387,top 5 mistake people try break cybersecurity make all post yt want info,fell phishing scam,wire half illegal sport livestreams show malicious ads
388,interview lead cybersecurity expert talk indepth cybercrimes cookie stuff remote access exploit dam nothing limit dabble podcast implore take listen regret,case phishing,windows 10s new blue screen death qr code may new method deliver malware
389,ceo dozens company entities charge scheme traffic estimate 1 billion fraudulent counterfeit cisco network equipment,seem legit lol,create malware sandbox second noriben
390,academics turn ram wifi card steal data airgapped systems,get google druve notifications everyday phishingwhat it,ecigarettes give malware technology
391,quiet employee,phishers let throw agency name make look really official,foxit reader free 6140217 malware yes
392,cisa issue emergency directive mitigate compromise solarwinds orion network management products,keep get fake ones,virustotal add pcap support file extraction snortsuricata alert
393,hackers access surveillance cameras tesla cloudflare bank,obvious phishing email redirect real paypal,malware analysis reverse engineer career
394,versions windows vulnerable new zeroday exploit,someone anything name address httpparcelexpressglobalcom fake,get malware analysis job self teach
395,skill shortage,zoom meet phishing how,another c fud implant httpstcovsf1zekaga enable operators send command via gmail gmailasc2 github httpsgithubcomreveng007sharpgmailc2
396,free train month february cybrary select premium course see below,soft hyphen email subject fool email filter successful phishing attack,malware triage tip stop waste time ida pack sample oalabs twitch clip
397,apparently full proof guide spot hackers england police many things wrong this,cybercrime stats,malcat 082
398,draft kings hack hackers steal 300k credential stuff attack,get order confirmation receipt order scam,video malware theory imphash algorithm explain
399,til cyber criminals help ai voice clone software use deepfaked voice company executive fool emirati bank manager transfer 35 million dollars personal account bank manager recognize executives voice work before,sneaky first send fake sharepoint link send email provider email link block email,technique use android malware prevent victim uninstall device how fix it
400,us state governments hit chinese hack spree least six state hack campaign take advantage widespread log4j security flaw accord mandiant,phishing email redditcom,easy malware sample
401,tryhackme good start point,confuse get 2 everyday last month,deep dive encryption obfuscation methods use cryptowall ransomware
402,heartland community college budget 1 million cybersecurity ransom attack,dumbass reply phishing email get send track number put up website legit,analyse emotet trickbot
403,australian police legally able upload malware suspect phone activate microphone listen conversations least 6 years ago nobody seem notice,email date website didnt sign for,poetrat python rat use covid19 lure target azerbaijan public private sectors
404,major activision hack reportedly compromise 500k cod account,bank america phishing email bypass spam filter,video malware theory network worm basics
405,89 cios believe cybersecurity top priority rest 2020,your mycra account expire receive text message husband link seem legit search number show info chinese website block number so receive another text different number thoughts,live malware analysis bladabindi rat
406,cybercrime group offer sixfigure salaries bonuses pay time attract talent dark web,scar keep receive hi my name jessicalisa etc email,new android malware survive factory reset
407,part 1 three years bug bounty hunt responsible disclosure,last week receive 3 strange texts w name link,bank trojans reference guide malware family tree
408,ciso brief red team engagement humor pretty real,spotify phishing paranoid cant log rn scar,redviper c2 framework use reddit control infect host
409,hey beyondtrust call employees boss security engineer tell interest product,insta phishing,avast abuser metamorfo bank malware hide abuse avast executable
410,google miniseries hack google,keep get email direct email address,whos behind gandcrab ransomware
411,former ciso uber find guilty two count 2016 breach,fell discord phishing link maximum damage could happend me,detect malware persistence memory xpost
412,worst nightmare cyberattack untold story solarwinds hack,5 ways detect phishing email examples,ongoing credit card data leak
413,trump administration look ban chinese apps include tiktok,phishing call service canada,malware analysis dedosfuscation use cyberchef
414,1st day work what mean cant find cable,spam email address,beginner reverse engineer ctf use linux cmdline
415,opinion keep country safe need national cyber academy think west point technology defense,dmarcorg domain protect reject policy,ransomware doctor without cure or make ransomware
416,ios zeroday let solarwinds hackers compromise fully update iphones,change region nintendo website japan today receive lot phishing email usual japanese,greyenergy reveal successor blackenergy apt group target poland ukraine
417,mark zuckerbergs phone number leak facebook data leak,send animator friend mine phishing scam,malware detection use machine learn
418,third malware strain discover solarwinds supply chain attack zdnet,new scam claim microsoft account team contact detail show email,youtube malware distribution campaign basic operation analysis article
419,existence cybersecurity internships proof cybersecurity requirements bs,apple phishing scam,remote desktop protocol rdp cache forensics xpost
420,break python ctx library take attacker steal environment variables aws key phps phpass also compromise possibly individual group,phished,think twitch stream something discuss malware part 2
421,john strand teach pay class ask anything,open iphone like idiot know be suggestions removal,russias kaspersky lab launch free antivirus software globally
422,fbi access private servers fix vulnerabilities notify afterwards yea nay,legit live europe location doesnt make sense know people michigan beyond odd so barely ever use pinterest email address come be noreplyaccountpinterestcom,various antianalyst trick use probably statesponsored malware
423,77 security leaders fear be perpetual cyberwar,actually anything,watch malware turn computer digital hellscape
424,we porn collection rise extortionware experts say trend towards ransom sensitive private information could affect company operationally reputation damage come hackers brag discover directors secret porn stash,get email password it say want bitcoin see its clearly fake c p get password,meet tox ransomware rest us
425,think belong too,recruitment phishing attempt,beginner level malware reverse engineer
426,cyber criminal need cissp 35 years experience degree perform entrylevel cybercrime think not,get really weird thing outlook inbox minutes ago ive get similarlooking email past anyone else happen them o_o,since cuckoo longer officially support 30 project revival hatch seem dead sandboxes standalone use
427,free course,receive text dare click link anyone know anything,want disgruntle employees deploy ransomware
428,whats must read book cyber security,instagram phishing,detect potential exploit cve202133909 sequoia falco linux fs privilege escalation
429,regret pentesting,google chrome warn real time get phished,reverse engineer warzone rat part 1 oalabs tutorial
430,us government sue idaho data company say track people abortion clinics,ive phished muckustorecom now,reverse engineer microsoft exchange dearcry ransomware brief analysis
431,microsoft russia behind 58 detect statebacked hack,email scam sextortion warn,malware sample
432,never share password d,report careful loose iphone,large emotet takedown jan 27 2021
433,drug cartels invest cyber security,sign lease agreement cancel suspicion scam,vietnam target complex supply chain attack
434,us gov unveil plan establish new bureau cyberspace digital policy part broader modernization effort at agency three key areas international cyberspace security international digital policy digital freedom,expose behind sextortion scam,come office
435,stop use work laptop phone personal stuff know,receive school email delete ignore tell it,track revils lalartu utilize multiple osint methods
436,microsoft say group behind solarwinds hack target government agencies,email contain password protect pdf name one passwords merit this,cybercriminals use malicious memes communicate malware
437,day life penetration tester,scotia bank account,master thesis dynamic behavioural analysis malware via network forensics
438,ever watch target perpwalked build,phishing attempt reddit,organizations worldwide hack extort use ryuk ransomware possible dprk connection
439,ads able bypass google play install apps without user consent digital turbine dsp seem one enable it,hbonow phishing,xori automationready disassembly static analysis library
440,tiktok quietly update privacy policy collect faceprints voiceprints,get phished a2 host domain name client,binary substring searchable malware catalog
441,bookingcom fin 475000 late report data breach,obviously one new phishing,petyaa ransomware
442,14 members revil ransomware gang arrestedraided,navy federal phishing,open analysis live viewer submission decode malicious vbs script
443,germanled police sting take worlds largest darknet marketplace whose australian allege operator use facilitate sale drug steal credit card data malware,natwest phishing sample email find inside phish kit,3 months since fortinet antivirus list software false positive make submission fix it response
444,solarwinds hackers access microsoft source code company say,payment successfully huh lookout trash download docx file thirsty mfs,transmission bittorrent infect
445,security research team gain complete unrestricted access microsoft azure account databases flaw allow user download delete manipulate massive collection commercial databases plus readwrite access underlie architecture cosmos db,legid nah im sorry never know post stuff website,cerber ransomware free decryption tool release
446,ex cisco employee delete 14m worth aws cloud months leave company could prevent this,cofense release new product combat phishing attack,botnet change search result major search engines nearly one million victims
447,german watchdog ban facebook use whatsapp users data,anyone list phishing sit,official public release malware analysis rpisec
448,russian surveillance cameras hack blast proukraine music,phishing scam email old password,strange case malware protect pc
449,coronavirus hackers face wrath cybersecurity community,authentication longer fit purpose seem,eff get control electronicfrontierfoundationorg use nefarious purpose
450,discover security vulnerability target reward notify notify anybody else target sue you,phishing tool gmailsnapchatsteam social media accountskali linux100 work,malware hide chinese inventory scanners target logistics ship firm
451,russia arrest 14 allege members revil ransomware gang include hacker us say conduct colonial pipeline attack,parent get phishing email scam,video packers polymorphism common misconceptions
452,accept position soc analyst,old nigerian prince scheme,analyze ttp overlap nine top ransomware
453,comptia security sy0601 free study resources,look these havent netflix almost year email zessvisscoat,dev0832 vice society opportunistic ransomware campaign impact us education sector
454,cheat sheet cert preps,real scam case package ship platform,black basta ransomware gang infiltrate network via qakbot brute ratel cobalt strike
455,anyone else feel like security field attract lot lowquality people hurt reputation,get phished like dnc,malware sandbox evasion x64 assembly check ram size part 1
456,lastpass hackers steal customer vault data cloud storage breach,onedrive phishing scam,lockbit ransomware sideloads cobalt strike beacon legitimate vmware utility
457,tell school glare security flaw system,reddit users beware evil twin,malware domains
458,nsa cisa release kubernetes harden guidance,new craigslist scam clpostidorg click troll back,ransomware protection resources
459,police hacker breach florida treatment plant poison water supply,phishing program checklist 5 years manage phishing train program ive learn,cut corner dridex downloader
460,us fcc fund program offer free phone lowincome people android phone come preloaded chinese malware cant remove,google ad amazon prime redirect phishing site,msdos malware josefine physical machine
