,CyberAttacks,Phishing,Malware
461,anonymous hack yandex taxi cause massive traffic jam moscow,phishingscam mail fake apple,warn video downloadhelpers helper program companion app
462,seethe rage idiots limit password complexity length,one more elaborate phishing email ive receive,russian apt28 hackers spot leverage covid19 phishing lure deliver go version zebrocy
463,north korean hackers breach south koreas atomic research agency vpn bug,chrome firefox phishing attack use domains identical know safe sit,parent pid ppid spoof ransomware analysis use ghidra sysmon t1134
464,kudankulam nuclear power plant deny victim cyber spy attack,phishing email mistake,cerberus android bank trojan active
465,whole isc2 election story,good try a,kuku
466,new windows zeroday public exploit let become admin,phishing scam even fool tech nerdsheres avoid,newbie here
467,free practical ethical hack course cyber mentor,email phishing scam scammers attempt fake message paypal,wannabe ransomware operators arrest hospital attack
468,ms appear sign several rootkits reach back chinese ips,namecheap spew phishing email,macos malware researchers bypass xprotect catalina
469,hit lottery,anyone ever receive phishing attempt detail,small python script make use virustotal api identify potentially malicious sample
470,farewell legend trycatchhcf pass away take care,legit look email paypal totally fake invoice,av evasion techniques
471,amazon delivery drivers consent ai surveillance vans lose job,respond phising email,trojanwin32tiggreplock exactly do
472,windows xp source code allegedly leak online,redditmailcom,oracle weblogic vulnerability exploit deliver ransomware
473,think could help someone come field,paypal phishing scam,jpeg hide exe
474,fbi director wray urge company stop pay ransom hackers,g data report phishing upon open browser,pull thread memory forensics xpost
475,download app smartphone delete asap heres,email message receive geeksquademailinfogeeksquadcom geeksquad,apple app store game find communicate malware
476,tesla hack steal use key fob,standard attempt,aurora ransomware infect you decrypt file free
477,microsoft exchange server attack theyre hack faster count say security company zdnet,lock screen passcode may phished,pdf mac malware 2018
478,10 things watch detection phishing mail,people fell victim scam phishing attack honey trap open infect fileclicked bad link happen bad it,rokrat analysis
479,reddit cyberattack let hackers steal source code internal data,know go here want post somewhere online,build malware bypass ml av siem
480,amazon get huge fine violate gdpr,paypal scam question,analyze emotet sure do might find useful
481,500000 zoom account find sale dark web,friend subscriber od avast security recently get mail email adress find dark web similar exoerience offer another plan would pay ofc problem would resolve,windows process genealogy xpost
482,sinclair tv station disrupt across us ransomware attack,8 step prevent whale phishing attack,exclusive congress ask us agencies kaspersky lab cyber document
483,russias aggressive ransomware group disappear its unclear make happen,unsubscribe legit spam mail,inject code elf binary howto
484,how get cybersecurity experience talk conjunction wnational cybersecurity career awareness wk,click phishing sms,watch malware steal data air gap pc blink light drone
485,tmobile say hackers steal data 37 million customers,sneaky phishing attack target apple users us,whats coolestmost interest persistence technique see malware use
486,twitter accuse cover data breach,suspect phising mail unknown github repository,find malware script do
487,hackers breach us census bureau january 2020 via citrix vulnerability,enter name address appear scam usps website worry,dresscode android malware find 40 google play store apps
488,yes favorite department human resorce,mail package today post office hours later get phishing email supposedly post office coincidence something else go on,10 million android devices reportedly infect chinese malware
489,large russian bank report pwned,recieved letter ship royal mail blank page,malware museum
490,pass sec,scam go reddit eight get ethereum wallets do,javascript deobfuscation tool
491,polygon pay record 2 million bug bounty reward critical vulnerability,new type phishing paypal money request,malware builders work without expose source code need compiler
492,new york city law firm serve worlds biggest star stage screen appear fall victim revil ransomware attack attackers threaten expose nearly 1tb celebrities private data unless bitcoin ransom pay,phishing,atm skimmer gang firebomb antivirus firm
493,poohpooh,get phished,yaralyzer new tool visualize force decode yara regular expression match binary text
494,pegasus spyware infect us state department iphones,phishing attempt google drive,chromeloader browser hijacker
495,chinese hackers access us hack tool years leak online,keep get stupid texts like this way block phone,beginner pentester want become malware analyst
496,idk post post save reference,phishing work well crims use deepfakes accord sophos,year report task force urge us keep ransomware front burner
497,instructor seem think regular people dont get hack,toyota reveal data leak 300000 customers,malware analysis series mas second article pdf 96 page
498,malware catch use macos zeroday secretly take screenshots,anything stop phishing email dead dad,malware emulator
499,millions dell pcs grant malware rogue users adminlevel access ask nicely,beware phishing attempt right reddit,process injection detection sysmon
500,tesla hack competition 1 million free car someone hijack model 3,accidentally click phishing link risk,question block
501,british govt scan internet devices host uk,glantoshop,video dump covid19jar rat java instrumentation
502,boss reluctant spend money cybersecurity get hack,credit card phishing text right use,bulletproof host theres new kid town
503,solarwinds hackers return launch phishing campaign use compromise account us foreign aid agency,accidentally click phishing link email,malwinx framework learn malware win32 function
504,60 second crimp toolim network,threat actors exploit death queen elizabeth ii phishing attack lure target malicious sit design steal microsoft account credentials,smith wesson web site hack steal customer payment info
505,twitter bring 8 fee phishing email target verify account,soo get weird ass email today,september 2019s want malware
506,microsoft confirm another windows print spooler zeroday bug,whole new level phishing,review list find malicious sample
507,massive breach fuel call us action cybersecurity,sms phish,code injection example thread execution hijack win32
508,hackers breach tmobiles systems steal source code,fake netflix phishing text,recent trend malware analysis
509,new linux malware steal ssh credentials supercomputers,block email base specific format,defcon 2018 megathread las vegas august 912 2018
510,time ceos personally liable cyberphysical security incidents,build someone clone me free service notify users website clone use phishing attack,indepth analysis samsam ransomware boss spider
511,pass comptia sec 501 hour agohere do,steal phone,additional information regard recent ccleaner apt security incident
512,excellent thread password security plus resources cybersecurity general,reply yes bofa scam authorize check,leakerlocker mobile ransomware threaten expose user information
513,feel like cybersecurity sham lot company theyll say care reality dont would anyone able share personal experience,anyone see use nxtn url shortener try research give secure connection error,eli5 register domain shut wannacry
514,broadcom officially acquire vmware 61 billion usd,phished reply scam email,largescale ransomware attack progress hit europe hard
515,charge drop inspect element hacker missouri four anxious months,victim usps delivery address scam,predator pwned predator pain keylogger decompiled passwords decrypt
516,stumble upon public webcam stream kid bedroom contact isp rogerscom care less do,android malware,3 techniques malware author use evade sandbox analysis
517,think belong here,help need,suspicious program program startup cause invisible icon tray when right click open file location grey out
518,audi volkswagen data breach affect 33 million customers,look sms phishing message new research,alternatives ida pro
519,rant cybersecurity need blue team red team,9700 steal phishing scam,locky ransomware 4th july
520,chinese cyber spy pose iranians target israeli government fireeye report,phishing scammers use layer security obfuscate attack,angler exploit kit evade emet
521,penetration test,click phishing link,ransomware overview name extensions pattern decryptors list google doc
522,chastitylock ransomware target mens bluetooth chastity belt,phone company antiphishing tech,lnkrus redirect malware report
523,make type something,get email gmail dont know address name ask talk something important,beginner find
524,good news national security systems require authentication best practice 15 years ago,wake today 50 email different websites,top german official infect extremely advance regin malware nsaties
525,researcher hack starlink terminal warn spacex flaw,mum experience phishing attempt whatsapp learningawareness websites available boomers,crack chinaz new shellshock campaign all usa infra
526,slack inform customers embed hash passwords invite link april 2017 july 2022 the bug discover invite link event along information share invite link include hash password user create revoke link,personal info get leak,test norton security fail major test
527,microsofts rich notifications windows 10 11 present new nativelooking browser popups readily fool users get phished download malware,come up someone tell be im danger,new apt duqu 20 hit highvalue victims include kaspersky lab
528,cybereason 80 orgs pay ransom hit,screw up think someone try scam,malware persistence
529,favorite cybersecurity podcast media,safe now,new ransomware 050 virustotal
530,hackers invade brazils health ministry servers health vaccination data about 50 tb hijack erase havent find source english yet,blockchain pdf email,goodbye microsoft security essentials microsoft recommend use thirdparty antivirus
531,learn write,safe,analysis security cleaner pro fake av 88 loaders 42 payloads
532,cyber swiss army knife web app encryption encode compression data analysis,email scammer old password,deepend research release library malware traffic pattern good ids alert xref
533,covid19 vaccine test center hit cyber attack steal data post online,anyone ideas be,source malware sample
534,cybersecurity podcast yall listen any,anyone else reddit get phished fake account,security researchers share lockbit 30 ransomware technical detail defense tip case study
535,guy happen again get leetcoded,possible create phishing link regain access instagram account ive lot friends loose account week id like help get back,packmypayload emerge threat containerize malware serve purpose proofofconcept present emerge risk container file format embed malware
536,solarwinds adviser warn lax security years hack,what joel okay instagram,german power electronics manufacturer semikron disclose hit ransomware attack partially encrypt company network
537,microsoft defender add command control traffic detection,phishing email make look like part ongoing email thread,conti ransomware target intel firmware stealthy attack
538,hackers leak 190gb allege samsung data source code,sure,worldwide deadbolt ransomware 1216 title all file lock deadbolt
539,microsoft president call solarwinds hack act recklessness,phisher send 2fa code phone,ideas good malware archive
540,database find good guy,phishing email,gh0stcringe malware target microsoft sql mysql servers
541,mysterious threat actor add servers tor network order perform ssl strip attack users access cryptocurrencyrelated sit tor browser,lame phishing text attempt i didnt click link lol,analysis tool save every drop file period time
542,hackers access fbi email system spam 100000 account,open spam email phone,practice malware analysis
543,stop chromifying web browsers please,get text claim contract stds anonymous person ive marry 15 years phishing prank,hashdb malware api hash obfuscation solve forever oalabs tutorial
544,eu try get backdoor access end end encrypt message,discover automate phishing tool sale dark web marketplace,ready analyze malware
545,company would work,phishing email someone family die,removal emotet botnet unlikely curb malware infections long term heres
546,get clear start journey cybersecurity couldnt pump,report spampotential phishing phishing,malware triage analyze prnloader use drop emotet oalabs tutorial
547,three terabyte worth record clip expose home security cameras upload online also sell interest party offer lifetime access onetime subscription fee us150,help,fibratus modern tool windows kernel exploration observability
548,new expert level ms cert come today microsoft cybersecurity architect sc100,interest phishing attempt appleididapplecom and valid apple mail server,android keylogger injector
549,razer data leak 100000 gamers personal information expose due server misconfiguration,danger,maze ransomware publish press release explain victims pay instead hire security company claim breach tech giant lg
550,tiktoks tie china pose significant privacy security risk im go leave,strange event get phished,another rdp brute force ransomware strike again time snatch team snatch team able go brute force domain administrator da account via rdp encrypt domain join systems less 5 hours
551,its time stop blame end users awareness train cannot stop phishing attack,quick thank,lokibot jigsaw malware process name drpbxexe description dolf run malware windows 7
552,anonymous take atlanta police dept site police shoot,citibank phishing sms help pls,new ransomware doesnt encrypt data also meddle critical infrastructure
553,lastpass security incident possible breach developer environment theft code technical information account compromise preliminary,click possible phishing site youtube channel,malware analysis google chrome password stealer video
554,accenture hit lockbit ransomware,checkphishai,antivmdetection script create templates use virtualbox make vm detection harder
555,dutch athletes warn keep phone laptops china,get phishing list,malware work malicious strategies tactics
556,uk politicians plan make pay ransom illegal company order thwart ransomware attack,phishers even try one anyway report bc wallet,part ii burn firefox firefox 0day drop macos backdoor osxnetwirea
557,think beyond resume,may fell something need help anxius,reality ransomware attack
558,us government launch new push hire cybersecurity talent position earn much vice president,strange redirect experience,carbanak source code leak
559,joint statement fbi cisa odni nsa solarwinds attack,get revenge scammer,look secret office 365 activities api xpost
560,kid smartwatches security nightmare despite years warn,weird ahs phishing email anybody else get these,walkthrough tutorial code statically unpack finspy vm part one x86 deobfuscation
561,help people iran reconnect signal request community,please excuse stupidity,evolution wannacry
562,hat color,obvious case phishing individual message claim somebody exist real life psychologist secure seemingly legitimate site office address please see comment additional information,passionate beginner question
563,department homeland security china use tcl tvs spy americans,phishing misinformation site,malware reach play store google wag war bankbot trojan
564,us charge two chinese spy global hack campaign target covid19 research,nhs phishing attack,anyone work malware analyst
565,ibm end facial recognition business ceo call bias inequality,warn clever phishing email microsoftcom how,xpost rransomware new sample kovter ransomware sign komodo 2556 vt
566,education giant pearson fin 1m downplay data breach,microsoft account security,largest malicious campaign google play 343 malicious porn clicker trojans
567,pass comptia security certification exam first go afraid,weird phishing link,vmcloak automate virtual machine generation cloak cuckoo sandbox
568,wanna get cybersecurity,question sms advice,malware analysis tutorials reverse engineer approach
569,soc analyst interview question,gmail security scam,teslacrypt decrypt
570,demand cybersecurity professionals overhyped,question regard sextortion email,microsoft seize noip domains allege malware host 245 piece malware begin filter microsoft dns
571,target park lot,click phishing link via sms iphone risk freak right now,citadel 1351 leak uncracked
572,zoombomber crash twitter hack hear pornhub videos since password set,one get me give username password card number pin address unfortunately realize suspicious give email social security number,malcat 090 hexadecimal editor disassembler malware analysis
573,plan digital death,hi guy anyone see kind email before ive get theyre always different name ive never open one pretty annoy,analyze javascript malware case study vjw0rm
574,log4shell explain metaphor memes,phishing site show mobile httpsdesjardinssuspensioncartexyz report it,use cyberchef automatically extract shellcode powershell loader oalabs twitch clip
575,white house announcements focus advance cybersecurity talent,anyone else get lot email different account daily get 23 contain pdf click nothing happen,discord malware analysis
576,pass sec thank everyone group support,putt card number code site take money still need block card even fingerprint verification use buy online,spyguard fork enhance version tinycheck main objective detect sign compromise monitor network flow transmit device
577,delete patreon account lay entire security team,click discord phishing link enter detail,dotdumper opensource automatic unpacker dotnet framework target file
578,thank rcybersecurity,fake sender,analyze cobaltstrike pcap
579,lawful access encrypt data act want ban strong encryption,phishing email anyone receive know its fake,offensive c
580,secret us mission bolster ukraines cyber defenses ahead russias invasion,gametightbullys_atl account hack,short investigation spam post find rworldnews
581,be risk 65 stressedout cybersecurity workers think quit,capitalonecom vs capitalone360com,new ransomware actor use passwordprotected archive bypass encryption protection
582,social engineer 20,scan link phishing checkphishai git information afterwards someone explain threat intelligence mean checkphishai mark clean still suspicions,fireeye capa support elf file
583,finally land job core cybersecurity,one new me poor email list,amazon kindle exploit allow hackers steal info even ereaders safe check point research report
584,ive put charge security idea im do,send blood sugar fix ads,3 million users instal malwarelaced chrome edge extensions list
585,study usa call complete ban facial recognition technology school find use technology likely amplify exist racial bias could result disproportionate surveillance students,potential instagram phishing,australia watchdog sue facebook mislead vpn app
586,us lawmakers may force company create backdoors softwarehardware,50 spam text message minute wont stop,emotet double blunder fake windows 10 mobile outdated message
587,microsoft say mitigate largest ddos attack ever record,securitymailinstagramcom scam,chipmaker maxlinear say hit maze ransomware attack
588,disclosure three 0day ios vulnerabilities critique apple security bounty program,top10vpncom dangerous site,repost due false dmca presumably person create script
589,talent shortage go away get worse ideas fix it,webcam record blackmail anyone see before,avamaria rat malware analysis writeup
590,wanna cybersec,report phishing custom browser user agent,make memz virus c remake viruses 1
591,fireeye release threatpursuit windows vm threat intel analysts,coinbase account verify without interact,analyze malicious spreadsheet drop dll
592,junior cyber position hire board junior position all,get phished steam,malware botnet emotet awake resume spamming campaign
593,soc interview come up heres common question,ive see video 8 different steam account now wonder anyone know origins,deep dive ios
594,linkedin copy content clipboard every keystroke ios 14 allow users see paste notification,sort phishing scheme,new ransomware germanwiper delete data ransom back
595,ibm microsoft amazon suspend sale facial recognition technology,get hotmail phishing attempt,heck ida ghidra take look
596,chinas secret out blackberry say govt hackers steal worlds sensitive data 10 years,valveteamdarkogmailcom phishing,gobrut new golang botnet
597,massive trove gun owners private information leak california attorney general,phishing scam genuine misunderstand,ask freeeasy malware repos pull
598,metasploit unleash free online ethical hack course,victim job scam phishing thorkelson consult ltd,windows malware cc actually write
599,millennials gen z less likely observe cybersecurity protocols older employees,question reddit post email,another mobile bank threat find google play detect test version
600,hacker steal government id database argentinas entire population,canada post phishing email,walkthrough malwaretechs beginner malware reverse ctf challanges strings3 shellcode1 shellcode 2 walkthrough vm 1 ransomware publish soon
601,free comptia security sy0601 study materials fully update 2021,accidentally click amazon phishing email link worry malwarevirus,kovter malware teardown include invisible registry persistence
602,quantumcomputing pioneer warn complacency internet security,see increase phishing use legitmate rout,expect malwaresecurity analyst job interview question
603,ceo want god right,phishing email contain email previously send,fake cryptocurrency wallet app find google play leak private key
604,guilty verdict uber breach case make personal liability real cisos,antiphishing solution recommend,cve20188174 double kill incorporate eks
605,take ride scammed think legitimate pentesting company redbot security,relate phising or onemusicstudioclub,anyone give suggestions malware analysis
606,help build free cybersecurity databasesearch engine resources comment link,click smshing link enter infochrome immediately close page get notification threat ok,analysis telebots cunning backdoor
607,hackers steal steam account new browserinthebrowser attack,click phishing link email bring actual site,diskcoderpetya analysis supplychain attack ukraine telebots group
608,im complete idiot,wake 800 email random different company say phishing,mouse over macro spam run europe use hover action deliver bank trojan
609,kaspersky release tinycheck open source detection tool capture network packets smartphone device quickly analyze malicious communication use heuristics specific indicators compromise,fake link real site,turlas water hole campaign update firefox extension abuse instagram
610,top notch security ohio state,image phishing email,examine morris worm source code malware series 0x02
611,microsoft confirm new ransomware family deploy via log4j vulnerability,corrupt phishing database,cybersec think tank insecuritybydesign mean iot botnets stay
612,hackers erase western digital hard drive remotely,attack california state controller serve warn businesses phishing threat,hajime decentralize iot worm
613,us cyber tool turn americans limit bidens options russia,top tip run successful ethical phishing campaign part cyber awareness startegy,heavily obfuscate polymorphic php malware
614,im nick percoco chief security officer kraken founder spiderlabs trustwave thotcon hacker conference chicago ask anything cryptocurrency hack breach security tip cybersecurity investigations,random similar phone number keep call,huge spam malware network go offline
615,us fcc add kaspersky lab china telecom firm national security threat list,blackeye,favorite osint sit iocs
616,us announce seize hive ransomware gang leak sit decryption key,anyone tell tf this lol im actually wheeze coz play,would like become malware analyst preconfigured vms use learn
617,docker malware common devs need take docker security seriously,free link analyzer,advance spyware android available script kiddies everywhere
618,til tvs emit tone ad break inaudible humans smartphones listen for corporate entities link tv phone belong person mean govt entities play tone thru tv ping phone room identify whole group,click phishing link,hack team hack team leak unleash flamelike capabilities wild
619,cisa fbi nsa release cybersecurity advisory russian cyber threats us critical infrastructure,apple phising even apple,fiverrcom hack serve windows malware
620,russia cut self global internet test defenses rbc,covid19 vaccine phishing scam surge 26 three months,rombertik malware rewrite mbr audit
621,darkside ransomware net 90 million bitcoin,apple phishing attempt,recent os x malware sample
622,microsoft release cyberattack simulator shall play game,get link text address me click it number service,zeus p2p gameover malware get kernelmode rootkit
623,colleague care security prank,bank phishingfraud cua,vxheaven reload
624,ethical hack 12 hours free cyber mentor,find phishing sit particular brand,research windows sandbox javascript vm detection think malware download could use alot techniques
625,chinese hackers target biden campaign impersonate mcafee antivirus say google,ebay gift card new boss scam,malwarebytes block google youtube domains malware
